name,alias,smell,cure
银,亦名白金、鋈。,，辛、平、有毒；生，辛、寒、无毒。,1、妊妇腰痛。用银一两、水三升，煎成二升服之。2、胎动欲坠。用银五两、根二两、清酒一碗、水一大碗，煎成一碗，湿服。3、风牙疼痛。用文银一两，烧红渍入一碗烧酒中，趁热漱口。
自然铜,亦或石髓。,辛、平、无毒。,1、心气痛。用自然铜，先经火煅（即烧红），然后醋淬（即蘸醋酒上去，令红消热退），淬后又煅，反复九次，最后研为细末。每次取一小提撮，调醋服。2、项下气瘿（项下皮肤，伸张成囊，囊内不是水，而是气）。用自然铜丢在水缸里，每天饮食，都用此水。日久，气瘿自消。或把自然铜烧成烟气，张口吸入亦可。3、暑湿瘫痪。用自然铜烧红，酒浸一夜，加炮过的川乌头，五灵脂、苍术（酒浸）各一两，当归二钱，共浸酒里。浸后取出，做成丸子，如梧子大。每服七丸，酒送下。吃到四肢麻木，是瘫痪快好的表现，可以停止服药。
铜青,亦名，即器上所生的绿色物。市上常用制铜，使生绿，收取晒干即可用。,酸、平、微毒。,1、风痰引起的突然昏倒或瘫痪。用铜青二两，研细，水飞去滓，慢火熬干，再加入麝身一分，以糯米粉糊成丸子，如弹丸大。每一丸，分两次服，薄荷酒送。若风痰未全好，可再用朱砂酒冲同量丸药服。要吐出青绿色涎水，泻下恶物，才算病愈。此方名“碧林丹”。治小儿的这种病，宜用“绿云丹”。方子是：用铜青研末，不定量，加醋面糊丸，如芡子大，每次用薄荷酒化服一丸，服后不久，吐涎如胶，即有效。2、烂眼。用水调铜青，涂在碗底，艾火熏干后，刮下来涂烂处。3、头发恶红，不断脱落。用油磨铜钱末涂抹即生。
铅,又名青金、黑、金公、水中金。,甘、寒、无毒。,1、明目、固牙、乌须发。用铅半斤，熔成汁，趁热加桑条灰，同时以柳木搅拌，使成沙状细末，再筛过，用筛取的细末揩牙，揩后漱口，即又漱口水洗眼，有明目、固齿、乌须发之效。2、肾气攻心，奔豚喘急，面黑欲死。用铅二两、石亭脂二两、木香一两、麝香一钱。先把铅熔化，加入石亭脂，急炒。焰起时，含醋喷之。炒毕，倾入先掘好的地坑中，盖好。等冷后取出研细，再加米饭，做成丸子，如芡子大。每服二丸，热酒送下。或身上出汗，或通便通气病即愈。如大便还不通，可再服一丸，加玄明粉五分同服。3、妇女血气冷痛攻心。可照上方服药。
铅霜,亦名。是铅杂十五分之一合炼作片放坛中密封而成，经久即成霜。,甘、酸、冷、无毒。,1、小儿惊热（心肺积热，夜卧多惊）。用铅霜、牛黄各半分，铁粉一分，研匀。每服四分之一钱，竹沥汁送下。2、惊风疾（喉闭，牙紧）。用铅霜四分之一钱，加蟾蜍少计，为末。以乌梅肉蘸药揩在牙龈上；同时，把通关药吹进口里里。过一阵，喉牙就松开了。3、消渴烦热。用铅霜、枯白矾等分，研细，调蜜做成丸子，如芡子大。每次用棉花包裹一料丸药放在口里，含化后，咽下药汁。又方：铅霜一两，根黄、硝石各一两，研末，每次用一钱，冷水送下。
粉锡,即粉，又有解、铅华、定粉、瓦粉、光粉、水粉、白粉、官粉、胡粉等名。旧日妇女用来擦脸。古人称铅为黑。,辛、寒、无毒。,1、劳复与食复（按：大病初愈，尚未恢复，便有性交，引起发烧、便赤、卵肿或缩入等症状，叫做“劳复”。因贪食而旧病复发，叫做“食复”）。用粉锡少许，水冲服。2、小儿脾泄不止。用红枣二十个，去核，将粉锡填入，在瓦上烘干，去枣留粉，再研细。每服三分，米汤送下。3、赤白痢。用粉锡一两，调鸡蛋清，和灸烘焦，研细。每次用冷水冲服一钱。
铅丹,又名、丹粉、朱粉、华。系用铅、、等合炼而成。,辛、微寒、无毒。,1、消渴烦乱。用铅丹一钱，新汲水送下。服药后，宜吃荞麦粥。2、吐逆不止。用铅丹四两，加米醋半斤，煎干，在炭火中煅红，冷定后，研为末，和米饭做成丸子，如梧子大。每服七丸，醋汤送下。此方名“碧霞丹”。3、小儿吐逆水上。用铅丹研末，加枣肉捣匀，做成丸子，如芡子大。针挑一丸，在灯上烧过，研为细末，乳汁调服。此方名“烧针丸”。另一配方：在烧针丸的药方中加朱砂、枯矾各少许。
密陀僧,亦名没多僧、炉底。,咸、辛、平、有小毒。,1、痰结胸中不散。用密陀僧一两，加醋和水各一碗，煎干，研为末。每服取末二钱，以酒和水各一小碗，煎成一碗，趁热服下。以吐出痰涎为好。2、消渴饮水。用密陀僧二两，研末，在开水中浸过，取出，加一点蒸饼做成丸子，如梧子大。服时用浓蚕茧盐汤、或茄根汤、或酒送下都行。第一天吃五丸，以后每天增加九丸，直到一次吃到三十丸为止，不可多服，五、六次后，如见水恶心，即可停药。恶心时可吃点干食压一下。3、赤白下痢。用密陀僧三两，烧成黄色，取出研细，每服一钱，醋茶送下，一天吃三次。
锡,又名白、贺。,甘、寒、微毒。,恶毒风疮。
铁,亦称黑金、。,熟：辛、平、有毒。生铁：辛、微寒、微毒。,熟铁：烧红投酒中，饮酒，可治贼风。生铁：1、脱肛。用生铁二斤，水一斗，煮至五升，洗肛门，一天两次。对脱肛多年不收的人都有效。
铁粉,乃钢飞炼而成。,咸、平、无毒。,1、惊发热。用铁粉少许，水调服。2、伤寒发狂，胡言乱走。用铁粉二两、龙胆草一两，共研细，磨刀水调服。每服大人一钱，小儿五分。3、疔疮。用铁粉一两、蔓青根三两，捣乱如泥，敷疮上。一天换两次。
铁落,亦名液、铁屑、铁蛾。打铁时，火花散飞，细微如屑，飞动如蛾。,辛、平、无毒。,1、小儿丹毒。用铁落研细，调猪油涂搽。2、善怒发狂，惊邪癫。用铁落煎水服。
铁精,亦称。出煅炉中，细如尘，以色紫质轻者为佳。,平、微湿。,1、下痢脱肛。用铁精粉敷扑。2、妇女阴脱。用铁精加羊脂，裹在布。
白石英,暂无,甘、微温、无毒。,1、风虚冷痹，肾虚耳聋。取磁石五两，经火煅、醋淬各五次，加白石英五两，装入绢袋，浸一升酒中，过五、六天后，分次温取。酒尽，可再添酒。2、惊悸善忘（上隔风热，心脏不安，宜化痰安神）。用白石英一两、朱砂一两，共研细。饭后煎金银汤送下。3、石水肿坚（按：病象是四肢瘦，肚子大，腹水胀如坚石）。用白石英十两，捶成豆子大，装入瓷瓶，浸酒二斗瓶口泥封，周围以马粪和糠火烧之，常令小沸。约六小时后停火。第二天开始服用，每次服酒大半杯。一天三次，酒尽后，可再加酒如上法烧一次。
水银,亦名汞、、灵液、姹女。,辛、寒、有毒。,1、急惊风。用水银半两、生南星一两、麝香半分，共研细，加石脑油，捣成泥，做丸子，如绿豆大。每服一丸，薄荷汤送下。2、反胃吐食。用黑铅、水银各一钱半，结砂、硫磺各五钱，官桂一钱，共研细，分两次服。一半米汤、一半姜汗，调在一个碗中把药送下。3、胆热鼻血。用水银、丹砂、麝香等分，研细，每服半钱，新汲水送下。
水银粉,亦名汞粉、、峭粉、腻粉。由、、合炼而成。,辛、苦、有毒。,1、小儿涎喘。用末受精的鸡收一个，取出蛋清，加水银粉十钱拌合。装银器内，放在汤瓶上蒸熟，给病儿服下，或吐痰，或下泄，病即愈。但水银有毒，气虚小儿，不能用此方。2、小儿呕乳。用水银粉一钱、盐鼓（去皮）七粒，共研匀，合成丸子，如麻子大。每服三丸。藿香汤送下。3、大小便闭（胀闷欲死，持续两三天，有生命危险）。用水银粉一钱、生麻油一合，和匀，空腹时服下。
粉霜,亦名霜、白雪、白。乃水或水粉粉炼炼升华而成。,辛、温、有毒。,1、小儿急惊风。用粉霜二钱，白牵牛（炒过）、水银粉各一钱，共研细。每服二、三分。薄荷汤送下。以涎痰吐出为效。2、小儿烦躁口渴。用粉霜二至五分（即小儿年龄大小酌用），煮莲花汤送下，冬日用莲肉汤。3、风热惊狂。用粉霜一两、白面六钱，合做饼子，烤熟后研细，加水银粉半两、铅霜二钱半，共研为末，滴水揉成丸子，如梧子大。每服十至十五丸，米汤送下。此方名“神白丹”，治伤寒积热、搐风、惊狂，皆有效。
银朱,亦名猩红、紫。用石亭脂和同罐炼成。贴在罐口的是，贴在罐内的是珠。,辛、温、有毒。,1、小儿内钓（惊风，多啼）。用银朱半钱，乳香、煨蒜各一钱，共研细，捏成丸子，如粟米大。半岁儿五丸，薄荷汤送下。2、痰气结胸。用银朱半两、明矾一两，同研细。置瓦盏中，下加微火熔化。刮取，搓成丸子，每服一钱，茶和姜汁送下。此方名“鹤顶丹”。3、水肿，但大便尚通畅。用银朱半两、煅硫磺四两，共研细，加糊做成丸子，如梧子大。每次服三十丸。
灵砂,亦名二气砂。乃、合炼而成。水量多，硫磺量少。,甘、湿、无毒。,1、伏热吐泻。用硫磺半两、水银一钱，研细，加姜汁和面糊，做成丸子，如小豆大。三岁用，服三丸，冷水送下。大人可服三、四十丸。此方名“阴阳丸”。2、脾疼反胃。用灵砂一两、蚌壳粉一两，同炒红。加丁香、胡椒各四十九粒，共研为末。再加姜汁煮过的半夏粉，糊成丸子，如梧子大。每服二十丸，姜汤送下。3、冷气心痛。用灵砂三分、五灵脂一分，共研细。加稀糊做成丸子，如麻子大。每服二十丸。饭前服。饭前服，石菖蒲、生姜汤送下。
雄黄,亦名黄金石、石黄、熏黄。,夺、平、寒、有毒。,1、骨蒸发热（按：即今之肺结核）。用雄黄一两，加入小便一升中。另取方圆尺的石板一块，以炭火烧热，把雄黄尿汁淋在石上，垫上薄毡，令病人解衣顶被坐石上，勿使漏风。几次之后，病状即逐渐减轻。2、伤寒咳逆。用雄黄一钱、酒一杯，同煎，病人趁热嗅其气。3、阴部蚀烂，痛痒不已。用雄黄半两烧于瓶中，熏下部，有效。
雌黄,暂无,辛、平、有毒。,1、心痛吐水，不下饮食。用雌黄二两、醋二斤，慢火煎成膏，加干蒸饼和丸，如梧子大。每服七丸，姜汤送下。2、癫抽筋。用雌黄、炒铅丹各一两，共研为末，加麝香少许，在牛乳汁半升中熬成膏，仔细捣匀，做成丸子，如麻子大。每服三、五丸，温水送下。3、小便不禁。用雌黄一两半，研细。加干姜半两、盐四钱，同炒成黄色，合研为末。再加水和蒸饼，做成丸子，如绿豆大。每服十丸至二十丸，空心服，盐汤送下。
石膏,亦名细、。,暂无,1、伤寒发狂。用石膏二钱、黄连一钱，共研细。甘草煎汤，冷的送下。此方名“鹊石散”。2、小儿丹毒。用石膏粉一两调水涂搽。3、骨蒸劳（外寒内热，附骨而蒸，身体消瘦，饮食无味，四肢渐细，脚上浮肿）。用石膏十两，研细，水调服。每服一茶匙，一天两次。
滑石,亦名画石、液石、石、脱石、冷石、番石、共石。,甘、寒、无毒。,1、烦热多渴。用滑石二两，捣碎，加水三大碗，共煎成三碗。支渣留水，和米煮粥吃。2、女劳黄疸（下半天发热恶寒，小腹急，大便溏黑，额头变为黑色）。用滑石、石膏，等分为末，大麦汁送下。一日三次。小便大利即愈，腹满者难治。3、伤寒症流鼻血（因汗出不来而流鼻血。如血色紫黑，不可止血，还要服温性之药。等到有鲜血流出，便急服本药去止住）。用滑石粉和米饭，捏成丸子，如梧子大。每服十丸，在口中稍稍嚼破，清水送下。血立卡。
不灰木,亦名无灰木。其色白，如腐烂的木材，烧之不燃。,甘、大寒、无毒。,1、肺热咳嗽。用不灰木一两半、玄精石二两、灸甘草半两、贝母一两半、天南星（白矾水煮过）半两，共研细。每服半钱，姜汤送下。2、咽喉肿痛，五心烦热。用不灰木（先以牛粪烧红）四两、玄精石（煅红）四两、真珠一钱，共研细，加糯米少许，做成丸子，如芡子大。每服一丸。服时，用生地黄汁、粟米淘水研化后吞下。每天服两次。3、吐泻烦满，气逆腹胀。以不灰木、阳起石（煅起）、阿魏各半两，巴豆（去心）、杏仁（去皮）各二十五个，共研细。加粟米饭，做成丸子，如樱桃大。每服一丸。服时，把丸子穿一孔，在灯上烧到烟尽，再研为末，姜汤送下。
五色石脂,本品质似石而性粘，故名五脂。有脂、黄石脂、黑石脂、、等不同的类别，总称为“五色五脂”。,五种石脂都是甘、平、无毒。,1、大肠寒滑，小便精出。用赤石脂、干姜各一两，胡椒半两，共研为末，略加醋和饭，糊成丸子，如梧子大。每服五十至七十丸，空心服，米汤送下。2、赤白痢。用赤石脂末，清水送服一钱。3、腹痛冷痢，下白冻如鱼脑。用煅赤石脂、炮干姜，等分为末，加蒸饼少许，做成丸子。服量随年龄不同，一日服三次。
炉甘石,亦名炉先生。,甘、温、无毒。,1、眼睛突然红肿。用炉甘石（火煅、尿淬）、风火消，等分为末。每次取少许，加清水化匀点眼。2、各种翳膜。用炉甘石、青矾、朴硝，等分为末。每次取一小茶匙，化在开水中，等稍冷，即用以洗眼。一天洗三次。3、一切目疾。用炉甘石半斤，加锉成小粒的黄连四两，放在瓦罐里，煮两沸。去掉黄连，单取炉甘石研末，加片脑二钱半。共研匀，贮存在小瓦罐中。每次用少许点眼。多次必有效。又方：煅炉甘石一钱，盆硝一钱，共研细。热水泡来洗眼。
无名异,亦名炉先生。,甘、平、无毒。,1、打伤肿痛。用无名异为末，每服少许，酒送下。有散血、消肿、止痛之效。2、骨伤骨折。用无名异、甜瓜子各一两，乳香、没药各一钱，共研为末。每服五钱，热酒调服。小儿只服三钱。另用米粥涂纸上，酒上牡蛎（左旋者好）粉裹伤处，外用竹篦夹住。3、丹毒。用无名异研末，葱汁调涂。
石钟乳,亦称留公乳、虚中、石、、夏石、黄砂石。,甘、温、无毒。,1、一切劳嗽（胸膈痞满，咳嗽不已）。用石钟乳、雄黄、佛耳草、款冬花，等分为末。每用一钱，细烧成烟，以筒吸烟入喉。一天两次。2、急喘不停。用钟乳粉五钱、蜡三两，和匀，蒸在饭甑里。蒸熟取出，合成丸子，如梧子大。每服一丸，温开水送下。3、吐血损肺。用钟乳粉，每服二钱，糯米汤送下。
石脑油,亦名、石漆、猛火油、油、油。,辛、苦、有毒。,小儿惊热、疮虫癞等。
石炭,亦称煤炭、石墨、炭、石、焦石。,甘、辛、温、有毒。,1、刀伤。用石炭捣成粉，敷伤口。疮口太深不能速合者，加滑石。2、误吞金银及钱在腹中不下。用石炭（一块，杏核大）、硫磺（一块，皂角子大），共研细，酒送下。3、月经不通。用石炭末一钱调汤，送下去油的巴豆三粒，有效。
石灰,亦名石垩、垩灰、希灰、煅石、、矿灰。,辛、温、有毒。,1、中风口。用新石灰，醋炒后，调如泥，涂口侧。口向左歪，涂右边；口向右歪，涂左边。很快奶可牵正。2、风牙肿痛。用放了两年的陈石灰、细辛，等分为末，擦牙。3、虫牙。用石灰和沙糖塞在牙中。
阳起石,亦名起名、白石、石生。,咸、微温、无毒。,1、丹毒肿痒。用阳起石煅后研细，清水调搽。2、滑精（元气虚寒，精滑不禁，手足常冷，大便溏泄）。用阳起石煅后研细，加钟乳粉等分，再加酒煮过的附子末，调一点面粉把药合成丸子，如梧子大。每服五十丸，空心服，米汤送下。直至病愈为止。3、阳萎阴汗。用阳起石煅后研细，每服二钱，盐酒送下。
慈石,亦名玄石、处石、石、吸针石。,辛、寒、无毒。,1、耳聋。用慈石一小粒，放入病耳内。另耳不病，只放铁沙。病耳渐愈。又方：豆大慈石一粒，加少许穿山甲烧成的灰，用新丰包好塞耳内。口含生铁一小块，觉耳中有风雨声即不聋。2、老人虚损（风温，腰肢痹痛）。用兹石三十两、白石英二十两，捶碎，浸入两斗水中，放在露地上。每天取此水煮粥吃。过一年，体质转强。3、阳萎。用兹石五斤，研细，淡酒浸半月。每服三合，白天服三次，临睡前服一次。
代赭石,亦名须丸、血师、土朱、朱。,苦、寒、无毒。,1、哮喘，睡卧不得。用代赭石，研末，米醋调服。宜常服用。2、伤寒无汗。用代赭石、干姜，等分为末，热醋调匀搽在两手心上，然后紧握双拳夹在大腿间。盖被静卧，汗出病愈。3、急慢惊风（吊眼，撮口，抽筋）。用代赭石（火煅、醋淬十次）研细，水飞后晒干。每服一钱或半钱，真金汤调下。连进三服，如脚胫上出现红斑，即是邪出病愈之证。如始终不现红斑，即无救。
禹余粮,亦名白余粮。,甘、寒、无毒。,1、大肠咳嗽（每咳便排出粪来）。用赤石脂、禹余粮各一斤，打碎，加水六升，煮成一升。去掉渣滓，分两次服。此方名“赤石脂禹余粮汤”。2、肠泄不止。用禹余粮四两（火煅、醋淬），加乌头一两，冷水浸一夜，去皮脐。两药共焙为末。稍滴醋加糊，做成丸子，如梧子大。饭前服五丸，温开水送下。3、赤白带。用禹余粮（火煅、醋淬），加干姜等分。如仅有赤带，则干姜减半。两药共研细。每服两茶匙，空心服。
空青,亦名青。,甘、酸、寒、无毒。,1、眼睛昏花不明。用空青少许，露一夜，次日，点眼。2、翳障。用空青、矾石（烧过）各一两，贝子四枚，共研细，每日点眼。又方：空青二钱，蕤仁（去皮）一两，片脑三钱，共研细，每日点眼。3、各种目疾（雀目、赤目、青盲、内外障翳、风眼等）。用空青（洗净）、胡黄连（洗）各二钱半，先取槐芽（天未明时乘露采得）适量，装于青竹筒内，悬挂起来，等候干燥。干后研细，取一钱半，与空青、胡黄连共研为末，再加龙脑少许，收存备用。病人每于睡前漱口后，仰头让人吹此药入两鼻内，随即安睡。效果显著。
曾青,曾，音层。，即层青。就是成为层状的。说：“曾青治目，义同空青”。,酸、小寒、无毒。,1、风热目疾（眼红或烂，怕太阳光，眼屎多，常流泪，或痒或痛）。用曾青四两，蔓荆子二两，炮姜、防风各一两，共研细，经常以少许吸入鼻中，有效。2、耳内恶疮。用曾青五钱、雄黄七钱半、黄芩二钱五分，共研为末，搽疮上。
绿青,亦名石绿、大绿。生于矿中。,小毒。,1、急惊昏迷。用绿青四两、轻粉一钱，共研细。以生簿荷汁合酒把药灌下。痰吐即愈。2、风痰迷闷。用绿青十两，乌头尖、附子尖、蝎尾各七十个，共研为末，加糊做成丸子，如芡子大。每服一丸，薄荷汁合酒送下。吐出痰涎便是见效。3、小儿疳疮（肾疳，鼻疳，头疮，耳疮等）。用绿青、白芷，等分为末。先以甘草水洗疮，再搽药。
扁青,亦名石青、。即今矿物学上的石青。,甘、平、无毒。,顽痰不化等症，兼有明目、利痰、生精、等功效。
石胆,亦名、黑石、君石、毕石、勒、立制石。,酸、辛、寒、有毒。,1、风痰。用石胆粉一钱，温醋汤调服。痰涎吐出即愈。小儿用量酌减。2、喉痹喉风。用石胆二钱半、白僵蚕（炒过）五钱，共研为末。每次取少许吹喉，痰涎吐尽，风痹自愈。此方名“二圣散”。3、口舌生疮。用石胆半两，放在锅内煅红，露一夜，研细。每次取少许搽疮上，吐出酸涎水。如此数次，病愈。
砒石,亦名、人言。生者名砒黄，炼者名。,苦、酸、暖、有毒。认为：辛、酸、大热、有大毒。,1、中风痰壅（四肢不收，昏愦若醉）。用砒霜一粒如绿豆大，研细。先以清水送服少许，再饮热水，大吐即愈。如不吐，可再服。2、休息下痢（病一、二年不愈，人衰瘦不堪）。用砒霜、铅丹各半两，共投入已熔化的黄蜡中，柳条搅拌，条焦则换，六、七条之后，取出做成丸子，如梧子大（小儿服者只作成黍米大）。冷水送下。3、疟疾。用砒石一钱、绿豆粉一两，共研为末，加水调成丸子，如绿豆大。铅丹为衣，阴干。发病日，五更起来，以冷水送服五至七丸。又方：砒石（醋煮过）、硫磺、绿豆，等分为末，包成若干个小包，每包分量约一粒豆子大。每服一包，空心服，新汲水上。这是一个很有效的治疟方。
金星石,，石外有金色麸片；星石，石外有银色麸片。两者的药效，大体相似。,甘、寒、无毒。,。用金星石、银星石、、、、各等分。取坩锅一个，铺冬月水牛粪一、二寸，铺约一层，铺灰二寸，又铺药一层，如此重复铺好，最后盖上灰，加盖封牢。在中煅一天一夜，还要埋在土中一夜，然后去灰留药块，共研细，每药一两，加、各半钱、二钱半，炒过。每服一钱，汤送下。一天服三次。
礞石,有青、白二种，以青者为好。打开须有白星点，无星点者不入药。,甘、咸、平、无毒。,1、湿热痰症。用礞石、焰消各二两，煅过，研细，水飞，晒干。取一两，加酒蒸大黄八两、酒洗黄芩八两、沉得五钱，共研为末。水调成丸子，如梧子大。平常只服一、二十丸。如大便结，可增至一、二百丸，温开水送下。妊妇和患水泻者忌服。此方名“滚痰丸”。2、一切虚冷久积（滑痢，腹有癖块，妇女月经过多而又持久）。用礞石半斤，研细；硝石二两，也研细。共放坩锅内，盖严，炭火煅过，以尽灰二十斤左右为度。冷后取出，再加入赤石脂末二两，滴水为丸，如芡子大。等干后，又放坩锅内以小火煅过，待冷即收存备用。每服一丸至三丸。空心服，温水送下。泻痢日久者，可加至七丸。此方名“金宝神丹”。3、急慢惊风。风礞石一两、焰消一两，同煅过，研细。每服半钱至一钱。急惊风痰热者，用薄荷汁和生蜜调匀送下。慢惊风脾虚者，用木香汤和熟蜜调匀送下。此方名“夺名散”。凡痰壅咽喉，命在旦夕者，服此都有效。
花乳石,亦名。,酸涩、平、无毒。,1、五内崩损，大出血。用花乳石，煅过，研细。饭后，以童便一小杯煎温调服二钱，病重者可至五钱。血止后，宜服独参汤补身体。此方名“花乳石散”，见葛可久《十药神书》。又方：硫磺四两、花乳石一两，共打碎，晒干，装瓦罐中，以泥封口，再焙干，以炭火煅过，冷定后，取出研为细末，收存瓶中备用。此方也叫做“花蕊石散”，见“和剂局方”。治跌打损伤，下死胎，落胞衣，去恶血，都很见效。每服一钱，童便调服。2、多年目翳。用花乳石（水飞，焙过）、防风、川芎、甘菊花、白附子、牛蒡子各两，灸甘草半两，共研为末，每服半钱，茶汤送下。
金牙石,亦名黄。,咸、平、无毒。,虚劳湿冷。缓弱，不能行走。用、、、、、、、菌蓣、、、蒴根各四两，一斤。共药十二味。金牙石捣碎后，单独装在一个小袋子中，其余十一味，切成薄片，合装入一大袋子里。两袋同浸内，密封四日。取酒，一天服两次。这种叫做“小金牙酒”。
石燕,状如蚬蛤，色如土，坚重如石。指出：石燕有二：一种是这里所录的石燕，乃是石类；另一种是乳中。,甘、凉、无毒。,1、伤寒尿涩，小腹胀满。用石燕研细，葱白汤调服半钱。以消胀为度。2、久年肠风（按：指常年泻血）。用石燕磨水常服，不要间断，有效。3、多年赤白带下。每日磨石燕取汁取。一枚石燕可用三天。也可以把石燕研末，水飞过，每天取半钱至一钱，米汤送服。
食盐,亦名鹾。,甘、咸、寒、无毒。,1、下部蚀疮。将盐炒热，用布包好，令病人坐布袋上。2、胸中痰饮，欲吐不出。饮盐开水可促使吐出。3、病后两胁胀痛。炒盐熨之。
