name,alias,smell,cure
盐,亦名胡盐、羌盐、青盐、秃登盐、阴士盐（按：即现在所称的）。,咸、寒、无毒。,1、小便不通。用戎盐一枚，如弹丸大，加茯苓半斤、白术二两，水煎服。2、风眼烂脸。用戎盐化水点眼。3、痔疮漏疮。用白矾四两、青盐四两，共研为末，装入猪尿脬中，阴干。每服五钱，空心服，温水送下。
卤碱,亦名卤盐、寒石、。从碱地掘取，用作硝皮。,苦、寒、无毒。,1、风热赤眼，虚肿涩痛。用卤碱一升、青梅二十七个、古钱二十一文，密封于新瓶中，开水煮一顿饭时间，取出静放三天。点眼，一天点三、五次。2、牙齿腐烂。取上好碱土，热水淋之，去渣留汁，瓦罐熬干。刮下，加麝香少许，研细，搽患处。
凝水石,亦名卤盐、寒石、。从碱地掘取，用作硝皮。,辛、寒、无毒。,1、男女转脬，小便困难。用寒水石（按：此处指凝水石）二两、滑石一两、葵子一合，共研为末，加水一斗，煮成五升。每服一升。2、牙龈出血，有洞。用凝水石粉三两、丹砂二钱，甘草、脑子各少许，共研为末，干敷。3、汤火灼伤。用凝水石烧过，研细，敷伤处。
玄精石,亦名、阴精石、玄英石。,咸、温、无毒。,1、伤寒，头痛壮热，四肢不利。用玄精石、硝石、硫磺、各一两，硇砂二两，共研细，装地瓷罐里，蜜封。周围用火烘半天，药色变青紫时即停火。冷后取药以冷水拌匀，放入原罐中阴干。埋在地下半月。最后取出再研细，加面糊成丸子，如鸡头大。病入先洗一个热水澡，然后研碎一丸，艾汤送下。蒙被而卧，汗出见效。此方名“正阳丹”。2、肺热咳嗽。方见“不灰木”项下。3、冷热霍乱。用玄精石、半夏各一两，硫磺三钱，共研细，加面糊成丸，如梧子大。每服三十丸，米汤送下。
朴硝（硭硝、马牙硝）,亦名朴、盐硝、皮硝（“硝”原作为“消”）。,苦、寒、无毒。,1、骨蒸热（按：即结核病）。用硭硝粉，每服一茶匙。一天服两次。2、腹中痞块。用朴硝一两、独蒜一个、大黄末八分，共捣成饼，贴患处，以痞块消除为度。3、大小便闭，鼓胀欲死。用硭硝三两，泡在一升开水中，饮下。引起呕吐即愈。
玄明粉,亦称白粉。为白净，先与处同煎，后与甘划同煎，再经火煅制成。,辛、甘、冷、无毒。,1、热阙（按：指伏热引起的四肢厥冷）。用玄明粉三钱，热童便送下。2、伤寒发狂。用玄明粉二钱、丹砂一钱，研细，冷水送服。3、鼻血水上。用玄明粉二钱，清水送服。凡脾胃虚冷及阴虚火动者忌服玄明粉。
硝石,亦名硭硝、苦硝、焰硝、、地霜、生硝、北帝玄珠。,苦、寒、无毒。认为：应该是辛、苦、大温、无毒。,1、头痛欲死。以硝石末吹鼻内，即愈。2、心腹痛。以硝石、雄黄各一钱，研细。每点少许在眼眶内，即愈。此方名“火龙丹”。3、腰腹痛。也用火龙丹。
硇砂,亦名砂、狄盐、北庭砂、气砂、透骨将军。,咸、苦、辛、温、有毒。,1、肾脏积冷，心腹疼，面青脚冷。用硇砂二两、桃仁一两（去皮）。先以酒一小碗煮硇砂，沸十多次，去掉砂石，加入桃仁涨，慢慢熬成膏，和蒸饼做成丸子，如梧子大。每服二十丸，热酒送下。2、积年气块，脐腹疼痛。取木瓜三个，切开去瓤，将醋煮过的硇砂二两装入瓜内，晒在太阳下。到瓜烂时，研匀，加米醋五升煎浓，再加蜜收存。用时以附子末和成丸子，如梧子大。每服一丸，热酒化下。3、痃癖症块（按：症状为心胸绞痛，有积块）。取桑条烧灰，淋去苦汁，晒干。另按硇砂一两和水三两的比便，把硇砂、水、灰拌合起来，使干湿适当，然后放入瓶中。放前，瓶底热灰约半寸，放后，还要将灰填盖好。如此处理完毕，再以文武火煅红。冷定取出，倒药在小竹箕上（箕上先铺好三层纸），用热水淋药，收取滤汁，淋至硇味去尽为止。保持滤汁于热灰中，常令鼓出小鱼眼小泡。待汁干后，再煅一次，取药重研，加粟饭揉成丸子，如绿豆大。每服五丸，空心服，酒送下。
蓬砂,亦名鹏砂、盆砂。一作（）。,苦、辛、暖、无毒（李时珍认为：甘、微咸、凉、无毒）。,1、鼻血不止。用硼砂一钱，水冲服立止。2、肺痨。用硼砂、硇砂、兔屎，等分为末，加蜜做成丸子，如梧子大。每服七丸。生甘草一分，以水一杯揉汁，送药丸下。3、咽喉谷贼（按：指咽喉为谷物芒刺所伤，引起肿痛）。用硼砂、硭硝，等分为末，取半钱和蜜含咽。
石硫磺,亦称、黄、黄牙、阳侯、将军。（“磺”原作为“黄”）。,酸、温、有毒。,1、腰膝寒冷无力。用硫磺半斤，放在桑枝灰五斗的淋汁中，煮三沸。假干，以大火煅后研细。另取地坑里清水（穿地约一尺二寸，投水其中，等澄清后取用）和上述的硫磺末在坩锅中熬成膏子。再加米饭揉匀做成丸子，如麻子大。每服十丸，空心服，盐汤送下。2、脚气病。用硫磺粉三两、钟乳粉五升，加水煮沸，煎成三升。每服三合。又方：牛乳三升，煎至一升半。取五合，调硫磺粉一两。一次服下，蒙被而卧，须出汁为好，注意避风。如不出汗，再服药一次。隔几天之后，又照此服药。如此几次，可见效。3、伤寒阴症（极冷，厥逆烦燥，腹痛脉微）。煎艾汤服硫磺末三钱。安卧，出汗自愈。
石硫赤,亦名石亭脂、石、石硫。为之呈现红色者，功同硫磺。,苦、温、无毒。,1、赤鼻作痛。用呈紫色的石亭脂（红色者次之，黄色者勿用），研细，冷水调搽患处，半月可愈。2、风温脚气。用生石亭脂一两、生川乌头一两、无名异二两，共研为末，葱白捣汁和药做成丸子，如梧子大。每服一钱，空心服，淡茶加生葱送下。
矾石,亦名涅石、羽涅、羽泽；煅枯者名巴石，轻白者名矾。,酸、寒、无毒。,1、痰中风。用白矾一两、牙皂角五钱，共研细。每服一钱，温开水送下。2、胸胃积痰（头痛，不思饮食）。矾石一两，入水二升中煮成一升，加蜜半合。频频取饮，不久即大吐积痰。如不吐，可喝一点开水引吐。3、风痰病。用生白矾一两、细茶五钱，共研为末。和蜜成丸，如梧子大。小儿一岁吃十丸，大人可吃五十丸。久服，痰自大便排出，病根可断。此方名“化痰丸　。
绿矾,亦名、青矾。煅红者名绛矾或矾红。,酸、凉、无毒。,1、脾弱黄肿。用苍术二斤（淘米水泡两夜）、黄酒曲四两，同炒成赤色，加绿矾一斤，拦醋，晒干，装入瓶中火煅，取出研细，再加醋和糊成做成丸子，如梧子大　每服三、四十丸，好酒或米汤送下。一天服二至三次。此方名“伐木丸”，与平胃散同用，亦治肝气胀满。2、喉风肿闭。用绿矾一斤，拌入醋三斤中，晒干，研末吹喉部。痰涎流出后，以良姜末少许，放在茶内漱口咽下。3、眼睛红烂。用红枣五个，去核，填入绿矾，火上煨熟，加水两碗、桃柳心各七个，一起煎浓。每取少许点眼。
黄矾,暂无,酸涩、咸、有毒。,1、耳。用黄矾二两烧枯，取二钱，棉裹成球，塞耳内。2、身上瘢痕。用黄矾（烧令汁尽）、胡粉（炒黄）各八分，研细，加猪油，共捣成泥。先以粗布擦瘢，感到疼痛时，把药涂上，涂药五次以后，再用老鹰粪、燕窠草烧祳灰等分，加人乳调匀涂瘢。皮肤能恢复正常。3、急疳蚀齿。用黄矾、绿矾各半钱，白矾（烧过）一钱，麝香一分，共研为末敷患处，吐出流涎，病渐愈。
